{
    "metadata":
    {
      "name": "Latviešu"
    },
    "startButton": "Sākt",
    "loadButton": "Apskatīt saglabātās spēles",
    "optionsButton": "Opcijas",
    "quitButton": "Iziet",
    "vSyncButton": "Vsync: ",
    "renderDistSlider": "Redzes attālums: ",
    "invertedMouseButton": "Apgriezta pele: ",
    "mouseSensitivitySlider": "Peles jutīgums: ",
    "soundButton": "Skaņa: ",
    "fovSlider": "Redzes lauks: ",
    "maxFPS": "Max FPS: ",
    "maxFPSUnlimited": "Max FPS: Neierobežots",
    "debugCrashButton": "Atkļūdošana: Uzkārt spēli",
    "keybindsButton": "Tastatūra",
    "languagesButton": "Valoda",
    "doneButton": "Pabeigt",
    "preAlphaText": "Sveicināti Cosmic Reach! \n Šī spēle ir agrīnā tapšanas stadijā, tai ir trūkstoši satura elementi, tā nav tuvu pabeigtai, \n un jūs visticamāk saskarsieties ar kļūmēm un kļūdaini saglabātām pasaulēm.\n Viss var tikt mainīts patreizējā spēle neataino gala stadiju.\n Spēle ir pieejama, lai jūs varētu dot atsauksmes un palīdzēt noteikt spēles nākotni.\n Laimīgu testēšanu... un spēles laušanu!",
    "okButton": "Ok",
    "Lighting": "Apgaismojums: ",
    "Respawn": "Atdzīvoties",
    "Return_To_Game": "Atgriezties spēlē",
    "Return_To_Menu": "Atgriezties uz izvēlni",
    "Saving": "Saglabā...",
    "Space_Day": "Kosmosa diena",
    "Dark_Night": "Kosmosa nakts",
    "Earth_Day": "Zemes diena",
    "Orange_Sky": "Oranžas debesis",
    "Pitch_Dark": "Piķa tumsa",
    "Overcast": "Apmācies",
    "Forward": "Uz priekšu",
    "Backward": "Uz atpakaļu",
    "Left": "Pa kreisi",
    "Right": "Pa labi",
    "Jump": "Palēkties",
    "Crouch": "Pietupties",
    "Sprint": "Skriet",
    "Prone": "Gulties",
    "Inventory": "Soma",
    "Drop_Item": "Nomest priekšmetu",
    "Hide_UI": "Paslēpt lietotāja interfeisu",
    "Screenshot": "Ekrānšāviņš",
    "Debug_Info": "Atkļūdošanas informācija",
    "No_Clip": "No-Clip",
    "Reload_Shaders": "Pārlādēt ēnotājus (Shaders)",
    "Fullscreen": "Pilnekrāna režīms",
    "Create_New_World": "Izveidot jaunu pasauli",
    "worldNameButton": "Pasaules nosaukums: ",
    "defaultWorldName": "Jauna pasaule",
    "worldSeedLabel": "Pasaules ģenerēšanas atslēga: <Nejauša>",
    "worldSeedLabel2": "Pasaules ģenerēšanas atslēga: ",
    "worldType": "Pasaules tips: ",
    "Return_to_Main_Menu": "Atgriezties uz galveno izvēlni",
    "returnButton": "Atpakaļ",
    "Open_Worlds_Directory": "Atvērt pasauļu sarakstu",
    "YT_Channel": "Sekojiet līdzi spēles tapšanai - youtube.com/@finalforeach",
    "Game_version": "Cosmic Reach Versija Pre-alpha-",
    "MAC_warning": "UZMANĪBU: Mac sistēmas pašlaik netiek atbalstītas. Spēle visticamāk nestrādās.",
    "Controller": "Kontrolieris",
    "Controllers": "Kontrolieri",
    "Controller_info": " atrasts!\nKontrolieru atbalsts nav pilnvērtīgs,\nun tiks uzlabots nākamojos jauninājumos.",
    "on_state": "Ieslēgts",
    "off_state": "Izslēgts",
    "World_name": "Pasaule-",
    "Screenshot_info": "Ekrānšāviņš saglabāts ",
    "Screenshot_error": "Kļūme saglabājot ekrānšāviņu.",
    "Loading": "Notiek ielāde",
    "RuntimeException": "Neizdevās ielādēt pasauli: ",
    "Tip1": "Izloka līknes...",
    "Tip2": "Izkantē stūrus...",
    "Tip3": "Ieveido pasauli...",
    "Tip4": "Iekrāso gaismekļus...",
    "Tip5": "Skalda skaldņus...",
    "Tip6": "Pavairo blokus...",
    "Tip7": "Izkārto apgabalus...",
    "Tip8": "Uzkrāj kosmosa putekļus...",
    "Tip9": "Sarindo kubus...",
    "Tip10": "Apvieno apgabalus...",
    "Tip11": "Pieaudzē mēnesi...",
    "Tip12": "Sakārto somas...",
    "Tip13": "Fresnel-ificē...",
    "Tip14": "Kolonizē planētas...",
    "Tip15": "Knifs: Izvēlies bloku ar vidējo peles pogu!",
    "Tip16": "Knifs: Izmēģini citas apgaismošanas metodes pauzes izvēlnē!",
    "Tip17": "Knifs: Nospied '$keybind_hideUI' lai paslēptu lietotāja interfeisu",
    "Tip18": "Knifs: Nospied '$keybind_screenshot' lai uzņemtu ekrānšāviņu!",
    "Tip19": "Knifs: Nospied '$keybind_debugInfo' lai apskatītu atkļūdošanas informāciju",
    "Tip20": "Knifs: Nospied '$keybind_dropItem' to drop the current item!",
    "Tip21": "Knifs: Nospied '$keybind_openInventory' to open the inventory!",
    "Tip22": "Knifs: Ieskrienies pret sienu priekš 'sien-driļļa', lai tiktu tālāk nekā lecot.",
    "OddTip1": "Potē šūnas...",
    "OddTip2": "Inkubē...",
    "OddTip3": "Upurē izmēģinājuma trusīšus...",
    "OddTip4": "Skaita aitas...",
    "OddTip5": "Utilizē satrupējušos audus...",
    "OddTip6": "Ievāc cilmes šūnas...",
    "OddTip7": "Ievāc orgānu \"donorus\"...",
    "OddTip8": "Pēta leviatānu...",
    "OddTip9": "Atkārto piegājienus...",
    "OddTip10": "Kategorizē īpatņus...",
    "OddTip11": "Knifs: Entropijai nepretosies."
  }
  