{
  "metadata":
  {
    "name": "Bahasa Indonesia"
  },
  "startButton": "Mulai",
  "loadButton": "Buka Direktori Penyimpanan",
  "optionsButton": "Opsi",
  "quitButton": "Keluar",
  "vSyncButton": "Vsync: ",
  "creditsButton": "Kredit",
  "renderDistSlider": "Jarak Render: ",
  "invertedMouseButton": "Mouse Terbalik: ",
  "mouseSensitivitySlider": "Sensitivitas Mouse: ",
  "soundButton": "Suara: ",
  "fovSlider": "FOV: ",
  "maxFPS": "FPS Maks: ",
  "maxFPSUnlimited": "FPS Maks: Tak terbatas",
  "debugCrashButton": "Debug: Crash permainan",
  "keybindsButton": "Keybinds",
  "languagesButton": "Bahasa",
  "rendererButton": "Renderer: ",
  "rendererNaive": "Naive",
  "rendererBatched": "Batched",
  "doneButton": "Selesai",
  "preAlphaText": "Selamat datang di Cosmic Reach! \n Game ini sedang dalam tahap awal pengembangan, fiturnya belum lengkap, belum mendekati selesai, \n dan kemungkinan besar akan terdapat bug, glitch, crash, dan korupsi dunia.\n Semuanya dapat berubah dan tidak mewakili permainan final.\n Ini tersedia untuk Kamu mainkan sehingga Kamu dapat memberikan umpan balik untuk membantu memandu masa depan game ini \n Selamat menguji... dan merusakan permainan!",
  "okButton": "Ok",
  "Lighting": "Pencahayaan: ",
  "Respawn": "Bangkit kembali",
  "Return_To_Game": "Kembali ke permainan",
  "Return_To_Menu": "Kembali ke menu",
  "Saving": "Menyimpan...",
  "Space_Day": "Siang Luar Angkasa",
  "Dark_Night": "Malam gelap",
  "Earth_Day": "Siang Bumi",
  "Orange_Sky": "Langit Oranye",
  "Pitch_Dark": "Gelap gulita",
  "Overcast": "Mendung",
  "Forward": "Maju",
  "Backward": "Mundur",
  "Left": "Kiri",
  "Right": "Kanan",
  "Jump": "Lompat",
  "Crouch": "Mendekam",
  "Sprint": "Lari",
  "Prone": "Tengkurap",
  "Inventory": "Inventaris",
  "Drop_Item": "Jatuhkan Item",
  "Hide_UI": "Sembunyikan UI",
  "Screenshot": "Tangkapan layar",
  "Debug_Info": "Info Debug",
  "No_Clip": "No-Clip",
  "Reload_Shaders": "Muat ulang Shaders",
  "Fullscreen": "Layar penuh",
  "Create_New_World": "Buat Dunia Baru",
  "worldNameButton": "Nama dunia: ",
  "defaultWorldName": "Dunia baru",
  "worldSeedLabel": "Benih dunia: <Acak>",
  "worldSeedLabel2": "Benih dunia: ",
  "worldType": "Tipe Dunia: ",
  "Return_to_Main_Menu": "Kembali ke Menu Utama",
  "returnButton": "Kembali",
  "Open_Worlds_Directory": "Buka Direktori Dunia",
  "YT_Channel": "Tonton devlognya di youtube.com/@finalforeach",
  "Game_version": "Cosmic Reach Versi Pre-alpha-",
  "MAC_warning": "PERINGATAN: Mac tidak didukung saat ini. Kemungkinan besar permainan ini tidak akan berjalan dengan benar.",
  "Controller": "Kontroler",
  "Controllers": "Kontroler",
  "Controller_info": " terdeteksi!\nDukungan kontroler belum lengkap saat ini,\ndan akan ditingkatkan di pembaruan selanjutnya.",
  "on_state": "Nyala",
  "off_state": "Mati",
  "World_name": "Dunia-",
  "Screenshot_info": "Tangkapan layar disimpan ke ",
  "Screenshot_error": "Terjadi kesalahan saat menyimpan tangkapan layar.",
  "Loading": "Memuat",
  "RuntimeException": "Tidak dapat memuat dunia: ",
  "Tip1": "Retikulasi spline...",
  "Tip2": "Menekan simpul...",
  "Tip3": "Membentuk dunia...",
  "Tip4": "Mewarnai cahaya...",
  "Tip5": "Membelah dua lempengan...",
  "Tip6": "Mengisi blok...",
  "Tip7": "Melapisi potongan...",
  "Tip8": "Mengumpulkan debu luar angkasa...",
  "Tip9": "Mengorbit kubus...",
  "Tip10": "Mengelompokkan potongan...",
  "Tip11": "Mengentalkan bulan...",
  "Tip12": "Membersihkan inventaris...",
  "Tip13": "Fresnel-fikasi...",
  "Tip14": "Menjajah planet...",
  "Tip15": "Tip: Pilih blok menggunakan tombol tengah mouse!",
  "Tip16": "Tip: Coba ubah mode pencahayaan yang berbeda di menu jeda!",
  "Tip17": "Tip: Tekan '$keybind_hideUI' untuk menyembunyikan antarmuka pengguna",
  "Tip18": "Tip: Tekan '$keybind_screenshot' untuk mengambil tangkapan layar!",
  "Tip19": "Tip: Tekan '$keybind_debugInfo' untuk melihat informasi debug",
  "Tip20": "Tip: Tekan '$keybind_dropItem' untuk menjatuhkan item saat ini!",
  "Tip21": "Tip: Tekan '$keybind_openInventory' untuk membuka inventaris!",
  "Tip22": "Tip: Berlari ke dinding untuk 'berlari di dinding', melangkah lebih jauh dari yang Kamu lakukan hanya dengan melompat.",
  "OddTip1": "Mencangkok sel...",
  "OddTip2": "Inkubasi...",
  "OddTip3": "Mengorbankan subjek...",
  "OddTip4": "Menghitung domba...",
  "OddTip5": "Membuang jaringan mati...",
  "OddTip6": "Memanen sel induk...",
  "OddTip7": "Mengumpulkan \"sumbangan\" organ...",
  "OddTip8": "Mengamati tricephalous...",
  "OddTip9": "Uji coba berulang kali...",
  "OddTip10": "Mengkategorikan spesimen...",
  "OddTip11": "Tip: Kamu tidak bisa melawan entropi."
}
