{
  "metadata":
  {
    "name": "Cymraeg"
  },
  "startButton": "Dechrau",
  "loadButton": "Agor Ffolder Gemau",
  "optionsButton": "Opsiynau",
  "quitButton": "Gadael",
  "vSyncButton": "Vsync: ",
  "renderDistSlider": "Pellter Rendro: ",
  "invertedMouseButton": "Gwrth-droi Llygoden: ",
  "mouseSensitivitySlider": "Sensitifrwydd Llygoden: ",
  "soundButton": "Swn: ",
  "fovSlider": "Maes Golwg: ",
  "maxFPS": "Max FPS: ",
  "maxFPSUnlimited": "Max FPS: Anghyfyngedig",
  "debugCrashButton": "Dadfygio: Chwalu y gêm",
  "keybindsButton": "Rhwymiadau Bysell",
  "languagesButton": "Iaith",
  "doneButton": "Gorffen",
  "preAlphaText": "Croeso i Cosmic Reach! \n Mae'r gêm yn datblygiad cynnar iawn, mae'n nodweddion coll, yn unman bron yn gyflawn, \n a bydd namau, problemau, chwalu a llygredd yn namau.\n Gall popeth newid ac dydy hwn ddim yn cynrychiolydd o'r gêm olaf.\n Mae'r gêm ar glawr i chwarae i chi roi adborth i arwain dyfodol y gêm \n Profi happus!... a tori-gêm!",
  "okButton": "Iawn",
  "Lighting": "llucheden: ",
  "Respawn": "Atgyfodi",
  "Return_To_Game": "Dychwelyd i'r gêm",
  "Return_To_Menu": "Dychwelyd i'r dewislen",
  "Saving": "Yn cadw...",
  "Space_Day": "Dydd Gofod",
  "Dark_Night": "Nos Tywyll",
  "Earth_Day": "Dydd Daear",
  "Orange_Sky": "Awyr Oren",
  "Pitch_Dark": "Hollol Dywyll",
  "Overcast": "Cymylog",
  "Forward": "Ymlaen",
  "Backward": "Yn ôl",
  "Left": "Chwith",
  "Right": "De",
  "Jump": "Neidio",
  "Crouch": "Swatio",
  "Sprint": "Rhedeg",
  "Prone": "Cropian",
  "Inventory": "Rhestr Eiddo",
  "Drop_Item": "Gollwng Eitem",
  "Hide_UI": "Cwato UI",
  "Screenshot": "Sgrinlun",
  "Debug_Info": "Gwybodaeth Dadfygio",
  "No_Clip": "Dim-clipio",
  "Reload_Shaders": "Ail-lwytho Arlliw-wyr",
  "Fullscreen": "Sgrîn Lawn",
  "Create_New_World": "Creu Byd Newydd",
  "worldNameButton": "Enw byd: ",
  "defaultWorldName": "Byd newydd",
  "worldSeedLabel": "Hedyn byd: <Random>",
  "worldSeedLabel2": "Hedyn byd: ",
  "worldType": "Teip byd: ",
  "Return_to_Main_Menu": "Dychwelyd i'r Dewislen",
  "returnButton": "Yn ôl",
  "Open_Worlds_Directory": "Agor Ffolder Gemau",
  "YT_Channel": "Gwilio'r devlogs ar youtube.com/@finalforeach",
  "Game_version": "Cosmic Reach Fersiwn Pre-alpha-",
  "MAC_warning": "RHYBUDD: Dydy Mac ddim yn gweithio ar hyn o bryd. Mae'r gêm yn annhebygol i weithio.",
  "Controller": "Rheolwr",
  "Controllers": "Rheolwyr",
  "Controller_info": " canfod!\nMae cymorth Rheolwr yn anghyflawn rwan,\nac cail amgen nes ymlaen.",
  "on_state": "Ymlaen",
  "off_state": "Oddi ar",
  "World_name": "Byd-",
  "Screenshot_info": "Cadw Sgrinlun i ",
  "Screenshot_error": "Problem Cadw Sgrinlun.",
  "Loading": "Llwytho",
  "RuntimeException": "Methu llwytho byd: ",
  "Tip1": "Tynnu'n ôl y splines...",
  "Tip2": "Fertigau gwasgu...",
  "Tip3": "Siapio'r byd...",
  "Tip4": "Goleuadau lliwio...",
  "Tip5": "Slabiau haneru...",
  "Tip6": "Poblogi blociau...",
  "Tip7": "Darnau haenu...",
  "Tip8": "Llwch gofod yn cronni...",
  "Tip9": "Ciwbiau cylchdroi...",
  "Tip10": "Yn sypynnu talpiau...",
  "Tip11": "Curdling y lleuad...",
  "Tip12": "Dad-annibendod rhestrau eiddo...",
  "Tip13": "Fresnel-ffugio...",
  "Tip14": "Gwladychu planedau...",
  "Tip15": "Awgrym: Pick block using y middle mouse button!",
  "Tip16": "Awgrym: Trïo newid y dull goleuo gwahanol yn y saib dewislen!",
  "Tip17": "Awgrym: Gwasgu '$keybind_hideUI' i cuddio'r user interface",
  "Tip18": "Awgrym: Gwasgu '$keybind_screenshot' i tynnu sgrinlun!",
  "Tip19": "Awgrym: Gwasgu '$keybind_debugInfo' i weld gwybodaethl dadfygio",
  "Tip20": "Awgrym: Gwasgu '$keybind_dropItem' i taflu eitem!",
  "Tip21": "Awgrym: Gwasgu '$keybind_openInventory' i agor y rhestr eiddo!",
  "Tip22": "Awgrym: Rhedeg yn erbyn wal i 'wall run', mynd pellach yna byddech chi neidio.",
  "OddTip1": "Grefftio celloedd...",
  "OddTip2": "Deori...",
  "OddTip3": "Aberthu pynciau...",
  "OddTip4": "Cyfrif defaid...",
  "OddTip5": "Gwaredu meinwe ymadawedig...",
  "OddTip6": "Cynaeafu bôn-gelloedd...",
  "OddTip7": "Casglu \"rhoddion\" organau...",
  "OddTip8": "Arsylwi tricephalous...",
  "OddTip9": "Treialon ailadroddus...",
  "OddTip10": "Categoreiddio sbesimenau...",
  "OddTip11": "Awgrym: Ni allwch ymladd yn erbyn entropi."
}
