{
    "metadata":
    {
      "name": "Kalaallisut (Greenlandic)"
    },
    "startButton": "Aallartigit",
    "loadButton": "Ammaruk Toqqornikoq Mappi",
    "optionsButton": "Toqqagassat",
    "quitButton": "Anillagit",
    "vSyncButton": "vSync: ",
    "renderDistSlider": "Isigisap Ugasissusaa: ",
    "invertedMouseButton": "Killormoortoq Muusi: ",
    "mouseSensitivitySlider": "Muusip Malussarissusia: ",
    "soundButton": "Nipia: ",
    "fovSlider": "FOV: ",
    "maxFPS": "Annerpaaffissaa FPS: ",
    "maxFPSUnlimited": "Annerpaaffissaq FPS: Killeqanngitsoq",
    "debugCrashButton": "Kukkusaq: Spilleq ajutooruk",
    "keybindsButton": "Naqitassamut Naqitassat",
    "languagesButton": "Oqaatsit",
    "doneButton": "Piareerpunga",
    "preAlphaText": "Tikilluarit Cosmic Reachimut! \n Spilleq suli sananeqarpoq, amigaateqarpoq atortunik, suli piareerneqanngilaq, \n aamma ajortoqarsinnaassooq, kukkusaqassooq, ajutoorneq aamma nunarsuaq ajortittoorneq.\n Suna tamaat allanngorsinnavoq aamma takutitsisuunngilaq spilleq piariikkamut.\n Spilliluumisinnaavutit malugititsinerussagavit ikiuutaallutit spillip siunissaanut \n Misiliilluarina... aamma spilleq-ajortinnera!",
    "okButton": "Ok",
    "Lighting": "Qila Qaamanera: ",
    "Respawn": "Uummaqqigit",
    "Return_To_Game": "Uterit Spillimut",
    "Return_To_Menu": "Uterit Menumut",
    "Saving": "Toqqorpaa...",
    "Space_Day": "Silaannarsuaq Ulloq",
    "Dark_Night": "Taartoq Unnuaq",
    "Earth_Day": "Nunarsuarmi Ulloq",
    "Orange_Sky": "Sungaartoq Aappaluttoq Qilak",
    "Pitch_Dark": "Taartuinnaq",
    "Overcast": "Nuiasoq",
    "Forward": "Siumut",
    "Backward": "Utimut",
    "Left": "Saamimmut",
    "Right": "Talerpimmut",
    "Jump": "Pissigit",
    "Crouch": "Ammoorit",
    "Sprint": "Arpagit",
    "Prone": "Pallorit",
    "Inventory": "Pigisat",
    "Drop_Item": "Nakkartiguk Atortoq",
    "Hide_UI": "Toqqoruk UI",
    "Screenshot": "Assiliigit",
    "Debug_Info": "Kukkusaq Paasissutissaa",
    "No_Clip": "Suunngitsunngorit",
    "Reload_Shaders": "Aallaqqaataaneeruk Qaamaneri",
    "Fullscreen": "Ulikkaaruk Sk√¶rm",
    "Create_New_World": "Nunarsualiorit",
    "worldNameButton": "Nunarsualiap Atia: ",
    "defaultWorldName": "Nutaaq Nunarsualiaq",
    "worldSeedLabel": "Nunarsualiap kisitsisia: <Arlaat>",
    "worldSeedLabel2": "Nunarsualiap kisitsisia: ",
    "worldType": "Nunarsualiaq Qanorittoq: ",
    "Return_to_Main_Menu": "Uterit Menu Pingaarnermut",
    "returnButton": "Uterit",
    "Open_Worlds_Directory": "Ammaruk Nunarsualiat Mappi",
    "YT_Channel": "Isiginnaaruk Spilleq sananeqarnera (Tuluttoorpoq/Englesk) youtube.com/@finalforeach",
    "Game_version": "Cosmic Reach Version Pre-alpha-",
    "MAC_warning": "MIANERSOQQUSSUUT: Macimut suli massakkut atorneqarsinnaanngilaq. Spilleq immaqa ajorsinnaavoq.",
    "Controller": "Aquttagaq",
    "Controllers": "Aquttakkat",
    "Controller_info": " nassaarineqarpoq!\n Aquttagamut Atortarnissaq suli piariinngilaq,\n aamma aaqqinneqassaaq siunissami spillimi.",
    "on_state": "Ikippunga",
    "off_state": "Qamippunga",
    "World_name": "Nunarsualiaq-",
    "Screenshot_info": "Toqqorpoq Assiliat uunga  ",
    "Screenshot_error": "Ajutoorpoq toqqornera assiliat.",
    "Loading": "Piariilerpoq",
    "RuntimeException": "Ajutoortoqarpoq nunarsualiornut isernissaa: ",
    "Tip1": "Ikiuut 1 Nutsersinnaangilara Uaniittoraluaq...",
    "Tip2": "Ikiuut 2 Nutsersinnaanngittoorpara aamma una...",
    "Tip3": "Isikkuliorpaa Nunarsualiat...",
    "Tip4": "Qalipaneqarput qaamanerit...",
    "Tip5": "Avinneqarput saluttut...",
    "Tip6": "Sananeqarpoq Issoqqaariffaarissut...",
    "Tip7": "Sanavai chunkit...",
    "Tip8": "Silaannarsuup pujoralai sanavai...",
    "Tip9": "Kaavippai Issoqqaariffaarissut...",
    "Tip10": "Sinneri chuckit sanavai...",
    "Tip11": "Qaammat!",
    "Tip12": "Piiarpai imaluunnit sanvai pisatat...",
    "Tip13": "Nunaliorluni Sivisua?...",
    "Tip14": "Nunarsiartarivai Planetit...",
    "Tip15": "Ikiuut: Muusimi kaavittaga toorukku kippariffissaaq isigisat tigussuat!",
    "Tip16": "Ikiuut: allanngortiguk qilak menup qulaaniittoq toorlugu!",
    "Tip17": "Ikiuut: tooruk F1 taava suna tamaat tammassoq kisia nunaq minillugu",
    "Tip18": "Ikiuut: tooruk F2 assiliiniaruit spilliminngaanniit!",
    "Tip19": "Ikiuut: Tooruk F3 paasissutissat takuniaukkit kisia Nunaliarnut iseqqaassuutit",
    "Tip20": "Ikiuut: Tooruk Q paarisat peerniarukku!",
    "Tip21": "Ikiuut: Tooruk E atortut takuniarukkit!",
    "Tip22": "Ikiuut: Iikkamut arpagit taava 'iigakkut arpassaatit', ungasinnerumukarsinnaassatit pissittaarnatit.",
    "OddTip1": "Eqqumiittut ikiuut 1: Paarnaarussiviliorit...",
    "OddTip2": "Eqqumiittut ikiuut 2: Manniliorit...",
    "OddTip3": "Eqqumiittut ikiuut 3: Tuniorakkit misissugat...",
    "OddTip4": "Eqqumiittut ikiuut 4: Kisikkit savatit...",
    "OddTip5": "Eqqumiittut ikiuut 5: Soqutiginagit toqunikut cellit...",
    "OddTip6": "Eqqumiittut ikiuut 6: Tigoorakkit celliliortartut...",
    "OddTip7": "Eqqumiittut ikiuut 7: Tigoorakkit timip atortui soorlu puat il. il.\"tuniorakkat\"...",
    "OddTip8": "Eqqumiittut ikiuut 8: Isiginnaaruk tricephalous...",
    "OddTip9": "Eqqumiittut ikiuut 9: Misileqattaaruk assiganik iluatsinnissaata tugaanut...",
    "OddTip10": "Eqqumiittut ikiuut 10: Immikkuukkit misissukkatit...",
    "OddTip11": "Eqqumiittut ikiuut 11: Unammisinnanngilat sanaat."
  }
  
