{
  "metadata":
  {
    "name": "Català"
  },
  "startButton": "Jugar",
  "loadButton": "Obre el directori de desades",
  "optionsButton": "Opcions",
  "quitButton": "Sortir",
  "vSyncButton": "Vsync: ",
  "renderDistSlider": "Distància de renderització: ",
  "invertedMouseButton": "Ratolí invertit: ",
  "mouseSensitivitySlider": "Sensibilitat del ratolí: ",
  "soundButton": "So: ",
  "fovSlider": "FOV: ",
  "maxFPS": "Màx. FPS: ",
  "maxFPSUnlimited": "Màx. FPS: Sense límit",
  "debugCrashButton": "Depurar: Fer fallar el joc",
  "keybindsButton": "Assignacions de tecles",
  "languagesButton": "Idioma",
  "doneButton": "Fet",
  "preAlphaText": "Benvingut a Cosmic Reach! \n El joc es troba en una fase molt inicial de desenvolupament, li falten funcionalitats, està lluny de ser complet, \n i probablement tindrà errors, defectes i corrupció de móns.\n Tot està subjecte a canvis i no és representatiu del joc final.\n Està disponible perquè puguis donar feedback per ajudar a guiar el futur d'aquest joc \n Bon proveït de proves... i a trencar el joc!",
  "okButton": "D'acord",
  "Lighting": "Il·luminació: ",
  "Respawn": "Ressuscitar",
  "Return_To_Game": "Tornar al joc",
  "Return_To_Menu": "Tornar al menú",
  "Saving": "Guardant...",
  "Space_Day": "Dia a l'Espai",
  "Dark_Night": "Nit fosca",
  "Earth_Day": "Dia a la Terra",
  "Orange_Sky": "Cel Taronja",
  "Pitch_Dark": "Foscor absoluta",
  "Overcast": "Ennuvolat",
  "Forward": "Endavant",
  "Backward": "Enrere",
  "Left": "Esquerra",
  "Right": "Dreta",
  "Jump": "Saltar",
  "Crouch": "Agatxar-se",
  "Sprint": "Córrer",
  "Prone": "Tombar-se",
  "Inventory": "Inventari",
  "Drop_Item": "Tirar l'Objecte",
  "Hide_UI": "Amagar la IU",
  "Screenshot": "Captura de Pantalla",
  "Debug_Info": "Informació de Depuració",
  "No_Clip": "No-Clip",
  "Reload_Shaders": "Recarregar Shaders",
  "Fullscreen": "Pantalla Completa",
  "Create_New_World": "Crear Nou Món",
  "worldNameButton": "Nom del món: ",
  "defaultWorldName": "Món Nou",
  "worldSeedLabel": "Llavor del Món: <Aleatori>",
  "worldSeedLabel2": "Llavor del Món: ",
  "worldType": "Tipus de món: ",
  "Return_to_Main_Menu": "Tornar al Menú Principal",
  "returnButton": "Enrere",
  "Open_Worlds_Directory": "Obre el Directori de Móns",
  "YT_Channel": "Mira els devlogs a youtube.com/@finalforeach",
  "Game_version": "Versió de Cosmic Reach Pre-alfa-",
  "MAC_warning": "ADVERTÈNCIA: El Mac no està suportat en aquest moment. És poc probable que el joc funcioni.",
  "Controller": "Controlador",
  "Controllers": "Controladors",
  "Controller_info": " detectat!\nEl suport del controlador està incomplet ara,\n i s'incrementarà en actualitzacions posteriors.",
  "on_state": "Activat",
  "off_state": "Desactivat",
  "World_name": "Món-",
  "Screenshot_info": "Captura guardada a ",
  "Loading": "Carregant",
  "RuntimeException": "No es pot carregar el món: ",
  "Tip1": "Reticulant splines...",
  "Tip2": "Esmolant vèrtexs...",
  "Tip3": "Donant forma al món...",
  "Tip4": "Donant color a les llums...",
  "Tip5": "Partint les lloses...",
  "Tip6": "Poblant blocs...",
  "Tip7": "Estratificant chunks...",
  "Tip8": "Acumulant pols espacial...",
  "Tip9": "Orbitant cubs...",
  "Tip10": "Agrupant chunks...",
  "Tip11": "Coagulant la lluna...",
  "Tip12": "Desordenant inventaris...",
  "Tip13": "Fresnel-ificant...",
  "Tip14": "Colonitzant planetes...",
  "Tip15": "Consell: Selecciona un bloc amb la rodeta del ratolí!",
  "Tip16": "Consell: Prova a canviar els diferents modes d'il·luminació al menú de pausa!",
  "Tip17": "Consell: Prem '$keybind_hideUI' per amagar la interfície d'usuari",
  "Tip18": "Consell: Prem '$keybind_screenshot' per fer una captura de pantalla!",
  "Tip19": "Consell: Prem '$keybind_debugInfo' per veure informació de depuració",
  "Tip20": "Consell: Prem '$keybind_dropItem' per deixar l'objecte actual!",
  "Tip21": "Consell: Prem '$keybind_openInventory' per obrir l'inventari!",
  "Tip22": "Consell: Corre contra una paret per 'correr pel mur', anant més lluny que si només saltessis.",
  "OddTip1": "Engraftant cèl·lules...",
  "OddTip2": "Incubant...",
  "OddTip3": "Sacrificant subjectes...",
  "OddTip4": "Comptant ovelles...",
  "OddTip5": "Descartant teixits morts...",
  "OddTip6": "Cultivant cèl·lules mare...",
  "OddTip7": "Recollint 'donacions' d'òrgans...",
  "OddTip8": "Observant tricephalous...",
  "OddTip9": "Repetint proves...",
  "OddTip10": "Categoritzant espècimens...",
  "OddTip11": "Consell: No pots lluitar en contra de l'entropia."
}
