{
    "metadata":
    {
      "name": "Српски"
    },
    "startButton": "Започни",
    "loadButton": "Отвори сачуване светове",
    "optionsButton": "Подешавања",
    "quitButton": "Изађи из игре",
    "vSyncButton": "Vsync: ",
    "renderDistSlider": "Видљивост: ",
    "invertedMouseButton": "Изврни миш: ",
    "mouseSensitivitySlider": "Осетљивост миша: ",
    "soundButton": "Звук: ",
    "fovSlider": "Видно поље: ",
    "maxFPS": "Максимални FPS: ",
    "maxFPSUnlimited": "Максимални FPS: Неограничен",
    "debugCrashButton": "Дебаг: Крешуј игру",
    "keybindsButton": "Поставке тастера",
    "languagesButton": "Језик",
    "doneButton": "Готово",
    "preAlphaText": "Добродошли у Cosmic Reach! \n Игра је у веома раној фази развоја, фале јој карактеристике, није ни близу завршетка \n и вероватно ће имати багове, гличеве, крешовање и корупцију света.\n Све се може променити и није репрезентација завршене игре.\n Игра је доступна како би сте дали повратне информације и обликовали будућност ове игре \n Срећно тестирање... и рушење игре!",
    "okButton": "У реду",
    "Lighting": "Осветљење: ",
    "Respawn": "Реинкарнација",
    "Return_To_Game": "Врати се у игру",
    "Return_To_Menu": "Врати се на мени",
    "Saving": "Чување...",
    "Space_Day": "Свермирски дан",
    "Dark_Night": "Тамна ноћ",
    "Earth_Day": "Земаљски дан",
    "Orange_Sky": "Наранџасто небо",
    "Pitch_Dark": "Мркли мрак",
    "Overcast": "Облачно",
    "Forward": "Напред",
    "Backward": "Назад",
    "Left": "Лево",
    "Right": "Десно",
    "Jump": "Скок",
    "Crouch": "Чучање",
    "Sprint": "Трчање",
    "Prone": "Лежање",
    "Inventory": "Инвентар",
    "Drop_Item": "Баци изабрани предмет",
    "Hide_UI": "Сакриј интерфејс",
    "Screenshot": "Усликај",
    "Debug_Info": "Дебаг информације",
    "No_Clip": "No-Clip",
    "Reload_Shaders": "Поново учитај Shader-e",
    "Fullscreen": "Цео екран",
    "Create_New_World": "Направи нови свет",
    "worldNameButton": "Име света: ",
    "defaultWorldName": "Нови свет",
    "worldSeedLabel": "Семе света: <Насумично>",
    "worldSeedLabel2": "Семе света: ",
    "worldType": "Врста света: ",
    "Return_to_Main_Menu": "Врати се на главни мени",
    "returnButton": "Назад",
    "Open_Worlds_Directory": "Отвори фасциклу светова",
    "YT_Channel": "Одгледај девлог на youtube.com/@finalforeach",
    "Game_version": "Cosmic Reach верзија Pre-alpha-",
    "MAC_warning": "Упозорење: Mac тренутно није подржан. Игра вероватно неће радити.",
    "Controller": "Контролер",
    "Controllers": "Контролери",
    "Controller_info": " пронађен!\nКонтролери тренутно нису у потпуности подржани,\nи биће дорађени у следећим верзијама.",
    "on_state": "Укључено",
    "off_state": "Искључено",
    "World_name": "Свет-",
    "Screenshot_info": "Слика сачувана у ",
    "Screenshot_error": "Грешка при чувању слике.",
    "Loading": "Учитавање",
    "RuntimeException": "Грешка при учитавању света: ",
    "Tip1": "Ретикулирање кривих...",
    "Tip2": "Гњечење тачака...",
    "Tip3": "Обликовање света...",
    "Tip4": "Бојење светла...",
    "Tip5": "Сечење плоча...",
    "Tip6": "Насељавање блокова...",
    "Tip7": "Таложење чанкова...",
    "Tip8": "Таложење свемирске прашине...",
    "Tip9": "Орбитирање коцака...",
    "Tip10": "Спајање чанкова...",
    "Tip11": "Подсиривање месеца...",
    "Tip12": "Чишчење инвентара...",
    "Tip13": "Френелификација...",
    "Tip14": "Колонизирање планета...",
    "Tip15": "Савет: Одабери блок кликом на средње дугме на мишу!",
    "Tip16": "Tip: Савет: Покушај да промениш врсте осветљења у пауза мениjу!",
    "Tip17": "Савет: Притисни '$keybind_hideUI' да сакријеш интерфејс",
    "Tip18": "Савет: Притисни '$keybind_screenshot' да усликаш!",
    "Tip19": "Савет: Притисни '$keybind_debugInfo' да видиш дебаг информације",
    "Tip20": "Савет: Притисни '$keybind_dropItem' да бациш изабрани предмет!",
    "Tip21": "Савет: Притисни '$keybind_openInventory' да отвориш инвентар!",
    "Tip22": "Савет: Трчи у зид како би одрадио 'wall run', да би прескочио већу раздаљину.",
    "OddTip1": "Пресађивање ћелија...",
    "OddTip2": "Инкубирање...",
    "OddTip3": "Жртвовање поданика...",
    "OddTip4": "Бројање оваца...",
    "OddTip5": "Одбацивање мртвог ткива...",
    "OddTip6": "Прикупљање матичних ћелија...",
    "OddTip7": "Прикпуљање органских \"донација\"...",
    "OddTip8": "Гледање трикефалоса...",
    "OddTip9": "Понављање експеримената...",
    "OddTip10": "Категоризирање примерака...",
    "OddTip11": "Савет: Не можеш се борити против ентропије."
  }
  