{
    "metadata":
    {
      "name": "Slovenčina (Slovensko)"
    },
    "startButton": "Štart",
    "loadButton": "Otvoriť Priečinok pre Ukladanie", 
    "optionsButton": "Nastavenia",
    "quitButton": "Ukončiť hru",
    "vSyncButton": "Vsync: ",
    "renderDistSlider": "Dohľadnosť: ",
    "invertedMouseButton": "Invertovať myš: ",
    "mouseSensitivitySlider": "Citlivosť myši: ",
    "soundButton": "Zvuk: ",
    "fovSlider": "Zorné pole: ",
    "maxFPS": "Max FPS: ",
    "maxFPSUnlimited": "Max FPS: Neobmedzené",
    "debugCrashButton": "Debug: Zhodiť hru",
    "keybindsButton": "Klávesové skratky",
    "languagesButton": "Jazyk",
    "doneButton": "Hotovo",
    "preAlphaText": "Vitaj v Cosmic Reach! \n Hra je ešte stále vo vývojovej fázy, chýbajú jej nejaké funkcie, je ďaleko od dokončenia, \n a pravdepodobne bude mať bugy, glitche, spadnutia a korupcie sveta.\n Všetko sa môže zmeniť a nereprezentuje finálny produkt.\n Je to sprístupnené pre vás na hranie aby ste mohli poskytnúť spätnú väzbu a tak pomôcť s budúcim vývojom tejto hry \n Šťastné testovanie... a ničenie hry!", 
    "okButton": "Ok",
    "Lighting": "Osvetlenie: ",
    "Respawn": "Oživiť",
    "Return_To_Game": "Späť do hry",
    "Return_To_Menu": "Návrat do menu",
    "Saving": "Ukladám...",
    "Space_Day": "Vesmírny Deň",
    "Dark_Night": "Temná Noc",
    "Earth_Day": "Zemný Deň",
    "Orange_Sky": "Oranžová Obloha",
    "Pitch_Dark": "Úplná Tma",
    "Overcast": "Zamračené",
    "Forward": "Dopredu",
    "Backward": "Dozadu",
    "Left": "Doľava",
    "Right": "Doprava",
    "Jump": "Vyskočiť",
    "Crouch": "Zakrádať sa",
    "Sprint": "Behať",
    "Prone": "Plaziť sa",
    "Inventory": "Inventár",
    "Drop_Item": "Odhodiť predmet",
    "Hide_UI": "Skryť UI",
    "Screenshot": "Snímka obrazovky",
    "Debug_Info": "Debug Informácie",
    "No_Clip": "No-Clip",
    "Reload_Shaders": "Obnoviť Tieňovače",
    "Fullscreen": "Celá obrazovka",
    "Create_New_World": "Vytvoriť Nový Svet",
    "worldNameButton": "Názov sveta: ",
    "defaultWorldName": "Nový svet",
    "worldSeedLabel": "Seed na vygenerovanie sveta: <Random>",
    "worldSeedLabel2": "Seed na vygenerovanie sveta: ",
    "worldType": "Typ Sveta: ",
    "Return_to_Main_Menu": "Zobraziť Menu",
    "returnButton": "Späť",
    "Open_Worlds_Directory": "Otvoriť Priečinok Svetov",
    "YT_Channel": "Sleduj vývoj na youtube.com/@finalforeach",
    "Game_version": "Cosmic Reach Verzia Pre-alpha-",
    "MAC_warning": "VAROVANIE: Mac nie je momentálne podporovaný. Je veľká šanca že hra nebude fungovať.",
    "Controller": "Ovládač",
    "Controllers": "Ovládače",
    "Controller_info": " detekované!\nPodpora ovládača je momentálne nekompletná,\na bude vylepšená v neskorších verziách.",
    "on_state": "On",
    "off_state": "Off",
    "World_name": "Svet-",
    "Screenshot_info": "Uložilo snímku obrazovky do ",
    "Screenshot_error": "Chyba pri ukladaní snímky obrazovky.",
    "Loading": "Načíťava",
    "RuntimeException": "Nemohlo načítať svet: ",
    "Tip1": "Reticulating splines...",
    "Tip2": "Squishing vertices...",
    "Tip3": "Shaping the world...",
    "Tip4": "Colouring lights...",
    "Tip5": "Halving slabs...",
    "Tip6": "Populating blocks...",
    "Tip7": "Layering chunks...",
    "Tip8": "Accumulating space dust...",
    "Tip9": "Orbiting cubes...",
    "Tip10": "Batching chunks...",
    "Tip11": "Curdling the moon...",
    "Tip12": "De-cluttering inventories...",
    "Tip13": "Fresnel-ificating...",
    "Tip14": "Colonizing planets...",
    "Tip15": "Tip: Vyber block pomocou stlačenia kolieska myši",
    "Tip16": "Tip: Skús zmeniť osvetlenie v esc menu!",
    "Tip17": "Tip: Stlač '$keybind_hideUI' na skrytie UI!",
    "Tip18": "Tip: Stlač '$keybind_screenshot' pre snímku obrazovky!",
    "Tip19": "Tip: Stlač '$keybind_debugInfo' pre debug informácie!",
    "Tip20": "Tip: Stlač '$keybind_dropItem' pre vyhodenie objektu!",
    "Tip21": "Tip: Stlač '$keybind_openInventory' pre otvorenie inventára!",
    "Tip22": "Tip: Rozbehni sa oproti stene pre 'wall run', dostaneš sa ďalej než sa dá len skákaním.",
    "OddTip1": "Grafting cells...",
    "OddTip2": "Incubating...",
    "OddTip3": "Sacrificing subjects...",
    "OddTip4": "Counting sheep...",
    "OddTip5": "Discarding deceased tissue...",
    "OddTip6": "Harvesting stem cells...",
    "OddTip7": "Collecting organ \"donations\"...",
    "OddTip8": "Observing tricephalous...",
    "OddTip9": "Repeating trials...",
    "OddTip10": "Categorizing specimens...",
    "OddTip11": "Tip: Nemôžeš bojovať proti entropii."
  }
  