{
  "metadata":
  {
    "name": "Englishyay (igpay atinlay)"
  },
  "startButton": "Artstay",
  "loadButton": "Openyay Avesay Irectoriday",
  "optionsButton": "Optionsyay",
  "quitButton": "itquay",
  "vSyncButton": "yncvsay: ",
  "renderDistSlider": "Enderray Istanceday: ",
  "invertedMouseButton": "Invertedyay Ousemay: ",
  "mouseSensitivitySlider": "Ousemay Ensitivitysay: ",
  "soundButton": "Oundsay: ",
  "fovSlider": "FOV: ",
  "maxFPS": "Axmay FPS: ",
  "maxFPSUnlimited": "Axmay FPS: Unlimitedyay",
  "debugCrashButton": "Ebugday: Ashcray ethay amegay",
  "keybindsButton": "Eybindskay",
  "languagesButton": "Anguagelay",
  "doneButton": "oneday",
  "preAlphaText": "elcomeway otay osmiccay eachray! \n ethay amegay isyay inyay eryvay earlyyay evelopmentday , ityay isyay issingmay eaturesfay , isyay owherenay earnay ompletecay, \n andyay illway ikelylay avehay ugsbay , itchesglay , ashescray andyay orldway orruptioncay.\n everythingyay isyay ubjectsay otay angechay andyay isyay otnay epresentativeray ofyay ethay inalfay amegay.\n it'syay availableyay orfay ouyay otay ayplay osay atthay ouyay ancay ivegay eedbackfay otay elphay uidegay ethay uturefay ofyay isthay amegay \n appyhay estingtay .  .  . andyay ame-breakinggay!",
  "okButton": "Okyay",
  "Lighting": "ightinglay: ",
  "Respawn": "espawnray",
  "Return_To_Game": "eturnray otay amegay",
  "Return_To_Menu": "eturnray otay enumay",
  "Saving": "avingsay...",
  "Space_Day": "acespay ayday",
  "Dark_Night": "arkday ightnay",
  "Earth_Day": "Earthyay ayday",
  "Orange_Sky": "angeoray yskay",
  "Pitch_Dark": "itchpay arkday",
  "Overcast": "Overcastyay",
  "Forward": "orwardfay",
  "Backward": "ackwardbay",
  "Left": "eftlay",
  "Right": "ightray",
  "Jump": "umpjay",
  "Crouch": "ouchcray",
  "Sprint": "intspray",
  "Prone": "onepray",
  "Inventory": "Inventory-yay",
  "Drop_Item": "opdray Itemyay",
  "Hide_UI": "idehay UIyay",
  "Screenshot": "eenshotscray",
  "Debug_Info": "ebugday Infoyay",
  "No_Clip": "onay-ipclay",
  "Reload_Shaders": "eloadray adersshay",
  "Fullscreen": "ullscreenfay", 
  "Create_New_World": "eatecray ewnay orldway",
  "worldNameButton": "orldway amenay: ",
  "defaultWorldName": "ewnay orldway",
  "worldSeedLabel": "orldway eedsay: <andomray>",
  "worldSeedLabel2": "orldway eedsay: ",
  "worldType": "orldway ypetay: ",
  "Return_to_Main_Menu": "eturnray otay ainmay enumay",
  "returnButton": "ackbay",
  "Open_Worlds_Directory": "Openyay orldsway irectoryday",
  "YT_Channel": "atchway ethay evlogsday atyay youtube.com/@finalforeach",
  "Game_version": "osmiccay eachray ersionvay epray-alphayay-",
  "MAC_warning": "ARNINGWAY: acMay isyay otnay upportedsay atyay isthay imetay. ethay amegay isyay unlikelyay otay orkway.",
  "Controller": "ontrollercay",
  "Controllers": "ontrollerscay",
  "Controller_info": " etectedday!\nontrollercay upportsay isyay incompleteyay ownay,\nandyay illway ebay improvedyay inyay aterlay updatesyay.",
  "on_state": "Onyay",
  "off_state": "Offyay",
  "World_name": "orldway-",
  "Screenshot_info": "avedsay eenshotscray otay ",
  "Loading": "oadinglay",
  "RuntimeException": "ouldcay otnay oadlay orldway: ",
  "Tip1": "eticulatingray inessplay...",
  "Tip2": "ishingsquay erticesvay...",
  "Tip3": "apingshay ethay orldway...",
  "Tip4": "olouringcay ightslay...",
  "Tip5": "alvinghay absslay...",
  "Tip6": "opulatingpay ocksblay...",
  "Tip7": "ayeringlay unkschay...",
  "Tip8": "umulatingacc acespay ustday...",
  "Tip9": "Orbitingyay ubescay...",
  "Tip10": "atchingbay unkschay...",
  "Tip11": "urdlingcay ethay oonmay...",
  "Tip12": "e-clutteringday inventoriesyay...",
  "Tip13": "esnelfray-iicatingfay...",
  "Tip14": "olonizingcay anetsplay...",
  "Tip15": "iptay: ickpay ockblay usingyay ethay iddlemay ousemay uttonbay!",
  "Tip16": "iptay: ytray angingchay ethay ifferentday ightinglay odesmay inyay ethay ausepay enumay!",
  "Tip17": "iptay: esspray '$keybind_hideUI' otay idehay ethay useryay interfaceyay",
  "Tip18": "iptay: esspray '$keybind_screenshot' otay aketay ayay eenshotscray!",
  "Tip19": "iptay: esspray '$keybind_debugInfo' otay ooklay atyay ebuggingday informationyay",
  "Tip20": "iptay: esspray '$keybind_dropItem' otay opdray ethay urrentcay itemyay!",
  "Tip21": "iptay: esspray '$keybind_openInventory' otay openyay ethay inventoryyay!",
  "Tip22": "iptay: intspray againstyay ayay allway otay 'allway unray' , oinggay artherfay anthay ouyay ouldway onlyyay ybay umpingjay.",
  "OddTip1": "aftinggray ellscay...",
  "OddTip2": "Incubatingyay...",
  "OddTip3": "acrificingsay ubjectssay...",
  "OddTip4": "ountingcay eepshay...",
  "OddTip5": "iscardingday eceasedday issuetay...",
  "OddTip6": "arvestinghay emstay ellscay...",
  "OddTip7": "ollectingcay organyay \"onationsday\"...",
  "OddTip8": "observingyay icephaloustray...",
  "OddTip9": "epeatingray ialstray...",
  "OddTip10": "ategorizingcay ecimensspay...",
  "OddTip11": "iptay: ouyay annotcay ightfay againstyay entropyyay."
}
