{
  "metadata":
  {
    "name": "suomi"
  },
  "startButton": "Aloita",
  "loadButton": "Avaa Tallennuskansio",
  "optionsButton": "Asetukset",
  "quitButton": "Poistu",
  "vSyncButton": "Vsync: ",
  "renderDistSlider": "Renderöintietäisyys: ",
  "invertedMouseButton": "Käänteinen Hiiri: ",
  "mouseSensitivitySlider": "Hiiren Herkkyys: ",
  "soundButton": "Äänet: ",
  "fovSlider": "Näkökenttä: ",
  "maxFPS": "Max FPS: ",
  "maxFPSUnlimited": "Max FPS: Rajaton",
  "debugCrashButton": "Debug: Kaada Peli",
  "keybindsButton": "Näppäimet",
  "languagesButton": "Kieli",
  "doneButton": "Valmis",
  "preAlphaText": "Tervetuloa Cosmic Reachiin! \n Pelin kehitys on vasta alkumetreillä sekä kaukana valmiista. Pelistä puuttuu ominaisuuksia.\n Tulet luultavasti kohtaamaan bugeja, glitchejä, kaatumisia sekä maailmakorruptiota.\n Kaikki on muutoksenvaraista, eikä nykyinen tila edusta valmista peliä.\n Peli on pelattavissa, jotta voit antaa palautetta ja auttaa ohjaamaan pelin tulevaisuutta. \n Hauskaa kokeilua... sekä pelinrikkomista!",
  "okButton": "Ok",
  "Lighting": "Valaisu: ",
  "Respawn": "Synny Uudelleen",
  "Return_To_Game": "Palaa Peliin",
  "Return_To_Menu": "Palaa Valikkoon",
  "Saving": "Tallennetaan...",
  "Space_Day": "Avaruuspäivä",
  "Dark_Night": "Pimeä Yö",
  "Earth_Day": "Maan päivä",
  "Orange_Sky": "Oranssi Taivas",
  "Pitch_Dark": "Pilkkopimeä",
  "Overcast": "Pilvinen",
  "Forward": "Eteen",
  "Backward": "Taakse",
  "Left": "Vasen",
  "Right": "Oikea",
  "Jump": "Hyppy",
  "Crouch": "Kyykky",
  "Sprint": "Juoksu",
  "Prone": "Makuu",
  "Inventory": "Tavaraluettelo",
  "Drop_Item": "Pudota Esine",
  "Hide_UI": "Piilota Käyttöliittymä",
  "Screenshot": "Kuvakaappaus",
  "Debug_Info": "Debugtiedot",
  "No_Clip": "No-Clip",
  "Reload_Shaders": "Uudelleenlataa Shaderit",
  "Fullscreen": "Kokonäyttötila",
  "Create_New_World": "Luo Uusi Maailma",
  "worldNameButton": "Maailman nimi: ",
  "defaultWorldName": "Uusi Maailma",
  "worldSeedLabel": "Maailman siemen: <Random>",
  "worldSeedLabel2": "Maailman siemen: ",
  "worldType": "Maailman tyyppi: ",
  "Return_to_Main_Menu": "Palaa Päävalikkoon",
  "returnButton": "Takaisin",
  "Open_Worlds_Directory": "Avaa Maailmakansio",
  "YT_Channel": "Katso kehityslogeja osoitteesta youtube.com/@finalforeach",
  "Game_version": "Cosmic Reach Versio Pre-alpha-",
  "MAC_warning": "VAROITUS: Mac ei ole tuettu alusta tällä hetkellä. Peli ei luultavasti toimi.",
  "Controller": "Ohjain",
  "Controllers": "Ohjaimet",
  "Controller_info": " tunnistettu!\nOhjaintuki on keskeneräinen,\nja sitä tullaan tulevaisuudessa parantamaan päivityksillä.",
  "on_state": "Päällä",
  "off_state": "Pois",
  "World_name": "Maailma-",
  "Screenshot_info": "Kuvakaappaus tallennettu: ",
  "Screenshot_error": "Virhe tallentaessa kuvakaappausta.",
  "Loading": "Ladataan",
  "RuntimeException": "Maailman lataus epäonnistui: ",
  "Tip1": "Paistetaan pikseleitä...",
  "Tip2": "Puristellaan verteksejä...",
  "Tip3": "Muotoillaan maailmaa...",
  "Tip4": "Värjäillään valoja...",
  "Tip5": "Puolitetaan laattoja...",
  "Tip6": "Lasketaan kuution kulmia...",
  "Tip7": "Kerrostetaan lohkoja...",
  "Tip8": "Kerätään avaruuspölyä...",
  "Tip9": "Taivutetaan kuutioita...",
  "Tip10": "Porrastetaan lohkoja...",
  "Tip11": "Tyhjennetään täysikuuta...",
  "Tip12": "Järjestellään tavaraluetteloita...",
  "Tip13": "Valaistaan kuun pimeää puolta...",
  "Tip14": "Kolonisoidaan planeettoja...",
  "Tip15": "Vihja: Poimi palikka hiiren keskinäppäimellä!",
  "Tip16": "Vihje: Kokeile eri valaistusasetuksia taukovalikossa!",
  "Tip17": "Vihje: Paina '$keybind_hideUI' piilottaaksesi käyttöliittymän!",
  "Tip18": "Vihje: Paina '$keybind_screenshot' ottaaksesi kuvakaappauksen!",
  "Tip19": "Vihje: Paina '$keybind_debugInfo' katsoaksesi debug-tietoja!",
  "Tip20": "Vihje: Paina '$keybind_dropItem' pudottaaksesi valitun esineen!",
  "Tip21": "Vihje: Paina '$keybind_openInventory' avataksesi tavaraluettelon!",
  "Tip22": "Vihje: Tee 'wall run' juoksemalla seinää pitkin päästäksesi hyppäämistä pidemmälle.",
  "OddTip1": "Siirretään soluja...",
  "OddTip2": "Haudotaan...",
  "OddTip3": "Suoritetaan uhrauksia...",
  "OddTip4": "Lasketaan lampaita...",
  "OddTip5": "Hävitetään kuollutta kudosta...",
  "OddTip6": "Kerätään kantasoluja...",
  "OddTip7": "Kerätään \"elinluovutuksia\"...",
  "OddTip8": "Tarkkailaan tricephalousta...",
  "OddTip9": "Toistetaan kokeita...",
  "OddTip10": "Luokitellaan näytteitä...",
  "OddTip11": "Vihje: entropiaa vastaan kamppailu on turhaa."
}
