{
    "metadata":
    {
      "name": "Svenska"
    },
    "startButton": "Starta",
    "loadButton": "Öppna Sparfils Mappen",
    "optionsButton": "Inställningar",
    "quitButton": "Avsluta",
    "vSyncButton": "Vsync: ",
    "renderDistSlider": "Render Distance: ",
    "invertedMouseButton": "Invertad Mus: ",
    "mouseSensitivitySlider": "Mus Känslighet: ",
    "soundButton": "Ljud: ",
    "fovSlider": "FOV: ",
    "maxFPS": "Max FPS: ",
    "maxFPSUnlimited": "Max FPS: Oändlig",
    "debugCrashButton": "Debug: Krascha Spelet",
    "keybindsButton": "Tangentbindningar",
    "languagesButton": "Språk",
    "doneButton": "Klar",
    "preAlphaText": "Välkommen till Cosmic Reach! \n Spelet är i ett väldigt tidigt stadie, funktioner saknas, det är inte i närheten av klart, \n det kommer troligtvis att finnas buggar, glitcher, crascher and världs korruption.\n Allting kan komma att ändras och är inte representativt för det färdiga spelet.\n Det är tillgängligt för dig att spela så att du kan ge feedback och hjälpa till att styra framtiden av spelet \n Glad testning... och spelkraschning",
    "okButton": "Ok",
    "Lighting": "Ljus: ",
    "Respawn": "Återuppstå",
    "Return_To_Game": "Tillbaka till spelet",
    "Return_To_Menu": "Tillbaka till menyn",
    "Saving": "Sparar...",
    "Space_Day": "Rymden Dag",
    "Dark_Night": "Mörk Natt",
    "Earth_Day": "Jorden Dag",
    "Orange_Sky": "Orange Himmel",
    "Pitch_Dark": "Bäcksvart",
    "Overcast": "Mulet",
    "Forward": "Framåt",
    "Backward": "Bakåt",
    "Left": "Vänster",
    "Right": "Höger",
    "Jump": "Hoppa",
    "Crouch": "Huka",
    "Sprint": "Springa",
    "Prone": "Krypa",
    "Inventory": "Förråd",
    "Drop_Item": "Kasta Föremål",
    "Hide_UI": "Göm UI",
    "Screenshot": "Skärmbild",
    "Debug_Info": "Debug Information",
    "No_Clip": "No-Clip",
    "Reload_Shaders": "Ladda om Shaders",
    "Fullscreen": "Fullskärm",
    "Create_New_World": "Skapa ny värld",
    "worldNameButton": "Världens namn: ",
    "defaultWorldName": "Ny Värld",
    "worldSeedLabel": "Världens frö: <Slumpmässig>",
    "worldSeedLabel2": "Världens frö: ",
    "worldType": "Världstyp: ",
    "Return_to_Main_Menu": "Återvänd till Huvudmeny",
    "returnButton": "Tillbaka",
    "Open_Worlds_Directory": "Öppna Världfils Mappen",
    "YT_Channel": "Se devlogarna på youtube.com/@finalforeach",
    "Game_version": "Cosmic Reach Version Pre-alpha-",
    "MAC_warning": "Varning: Mac stöds ej för tillfället. Spelet kommer troligtvis inte att fungera.",
    "Controller": "Kontroller",
    "Controllers": "Kontroller",
    "Controller_info": " upptäckt!\nStöd för kontroller är inte klart än,\noch kommer att förbättras i senare uppdateringar.",
    "on_state": "På",
    "off_state": "Av",
    "World_name": "Värld-",
    "Screenshot_info": "Sparade skärmbild vid ",
    "Screenshot_error": "Fel när skämbilden skulle sparas.",
    "Loading": "Laddar",
    "RuntimeException": "Kunde inte ladda värld: ",
    "Tip1": "Framställer kurvor...",
    "Tip2": "Krymper hörn...",
    "Tip3": "Formger världen...",
    "Tip4": "Färgar ljus...",
    "Tip5": "Skivar skivor...",
    "Tip6": "Populating blocks...",
    "Tip7": "Staplar chunks...",
    "Tip8": "Samlar rymddamm...",
    "Tip9": "Sätter kuber i omlopp...",
    "Tip10": "Batchar chunks...",
    "Tip11": "Ytsar månen...",
    "Tip12": "Vårstädar förråd...",
    "Tip13": "Fresnel-iserar...",
    "Tip14": "Koloniserar planeter...",
    "Tip15": "Tips: Välj block med mellersta musknappen!",
    "Tip16": "Tips: Testa att byta ljusläge i pausmenyn!",
    "Tip17": "Tips: Tryck på '$keybind_hideUI' för att gömma användargränssnittet",
    "Tip18": "Tips: Tryck på '$keybind_screenshot' för att ta en skärmbild!",
    "Tip19": "Tips: Tryck på '$keybind_debugInfo' för att se debug information",
    "Tip20": "Tips: Tryck på '$keybind_dropItem' för att kasta det hållna föremålet!",
    "Tip21": "Tips: Tryck på '$keybind_openInventory' för att öppna ditt förråd!",
    "Tip22": "Tips: Spring mot en vägg för att 'springa på väggen', då kommer du längre än om du bara hade hoppat.",
    "OddTip1": "Ympar celler...",
    "OddTip2": "Inkuberar...",
    "OddTip3": "Offrar subjekt...",
    "OddTip4": "Räknar får...",
    "OddTip5": "Kastar avliden vävnad...",
    "OddTip6": "Samlar in stamceller...",
    "OddTip7": "Samlar in organ \"donationer\"...",
    "OddTip8": "Observerar tricefalus...",
    "OddTip9": "Upprepar test...",
    "OddTip10": "Kategoriserar provexemplar...",
    "OddTip11": "Tips: Du kan inte kämpa mot entropi."
  }
  