{
    "metadata":
    {
      "name": "正體中文（臺灣）"
    },
    "startButton": "開始遊戲",
    "loadButton": "開啟存檔目錄",
    "optionsButton": "選項",
    "quitButton": "退出",
    "vSyncButton": "垂直同步：",
    "renderDistSlider": "視野距離：",
    "invertedMouseButton": "滑鼠反轉：",
    "mouseSensitivitySlider": "滑鼠靈敏度：",
    "soundButton": "音效：",
    "fovSlider": "視野廣度：",
    "maxFPS": "最大幀率：",
    "maxFPSUnlimited": "最大幀率：無限制",
    "debugCrashButton": "偵錯：強制崩潰遊戲",
    "keybindsButton": "按鍵設定",
    "languagesButton": "語言",
    "doneButton": "完成",
    "preAlphaText": "歡迎來到Cosmic Reach！ \n 本遊戲仍處於早期開發階段，功能並不完備，亦無完整遊戲內容， \n 可能會出現漏洞、閃退或導致世界檔案損毀。 \n 一切內容皆可能發生改變並且不代表最終遊戲。 \n 歡迎試玩本遊戲以便您提供回饋、協助指引遊戲未來走向。 \n 盡情測試... 和搞破壞！",
    "okButton": "Ok",
    "Lighting": "亮度：",
    "Respawn": "重生",
    "Return_To_Game": "返回遊戲",
    "Return_To_Menu": "返回選單",
    "Saving": "存檔中...",
    "Space_Day": "太空日",
    "Dark_Night": "黑夜",
    "Earth_Day": "地球日",
    "Orange_Sky": "橙天",
    "Pitch_Dark": "漆黑",
    "Overcast": "陰天",
    "Forward": "前進",
    "Backward": "後退",
    "Left": "左",
    "Right": "右",
    "Jump": "跳躍",
    "Crouch": "蹲下",
    "Sprint": "衝刺",
    "Prone": "臥地",
    "Inventory": "背包",
    "Drop_Item": "丟棄物品",
    "Hide_UI": "隱藏介面",
    "Screenshot": "截圖",
    "Debug_Info": "偵錯資訊",
    "No_Clip": "穿牆",
    "Reload_Shaders": "重整光影",
    "Fullscreen": "全螢幕",
    "Create_New_World": "創建新世界",
    "worldNameButton": "世界名稱：",
    "defaultWorldName": "新世界",
    "worldSeedLabel": "世界種子碼：隨機",
    "worldSeedLabel2": "世界種子碼：",
    "worldType": "世界類型：",
    "Return_to_Main_Menu": "返回主選單",
    "returnButton": "返回",
    "Open_Worlds_Directory": "開啟世界資料夾",
    "YT_Channel": "查看開發日誌：youtube.com/@finalforeach",
    "Game_version": "Cosmic Reach 版本 Pre-alpha-",
    "MAC_warning": "警告：當前不支援Mac裝置。遊戲很可能無法運行。",
    "Controller": "遊戲控制器",
    "Controllers": "遊戲控制器",
    "Controller_info": " 成功偵測！\n控制器當前並不提供完整支援，\n將在往後更新中進行改善。",
    "on_state": "開",
    "off_state": "關",
    "World_name": "世界-",
    "Screenshot_info": "儲存截圖至 ",
    "Screenshot_error": "儲存截圖時發生錯誤。",
    "Loading": "載入中",
    "RuntimeException": "無法載入世界：",
    "Tip1": "編織樣條...",
    "Tip2": "壓縮頂點...",
    "Tip3": "形塑世界...",
    "Tip4": "上色光源...",
    "Tip5": "半磚切片...",
    "Tip6": "填充方塊...",
    "Tip7": "疊加區塊...",
    "Tip8": "匯聚星塵...",
    "Tip9": "方塊入軌...",
    "Tip10": "區塊分批...",
    "Tip11": "凝成月球...",
    "Tip12": "整理背包...",
    "Tip13": "菲涅耳化...",
    "Tip14": "殖民行星...",
    "Tip15": "提示：使用滑鼠中鍵快速選取方塊！",
    "Tip16": "提示：在暫停選單中試試不同的亮度模式！",
    "Tip17": "提示：按下 '$keybind_hideUI' 隱藏遊戲介面",
    "Tip18": "提示：按下 '$keybind_screenshot' 擷取遊戲畫面！",
    "Tip19": "提示：按下 '$keybind_debugInfo' 查看偵錯資訊",
    "Tip20": "提示：按下 '$keybind_dropItem' 丟棄手中物品！",
    "Tip21": "提示：按下 '$keybind_openInventory' 打開背包！",
    "Tip22": "提示：對牆衝刺使出「牆跑」，比一般跳躍來得更遠。",
    "OddTip1": "移植細胞...",
    "OddTip2": "孵化...",
    "OddTip3": "獻祭物品...",
    "OddTip4": "數羊...",
    "OddTip5": "清除凋亡組織...",
    "OddTip6": "收成幹細胞...",
    "OddTip7": "收集器官\"捐贈\"...",
    "OddTip8": "觀察三頭獸...",
    "OddTip9": "反覆試驗...",
    "OddTip10": "歸類標本...",
    "OddTip11": "提示：你不能違背熵。"
  }
  