{
    "metadata":
    {
      "name": "Dansk (Danmark)"
    },
    "startButton": "Start",
    "loadButton": "Åben Gemt Data (Stifinder)",
    "optionsButton": "Indstillinger",
    "quitButton": "Afslut Spil",
    "vSyncButton": "Vsync: ",
    "renderDistSlider": "Synslængde: ",
    "invertedMouseButton": "Spejlvend Mus: ",
    "mouseSensitivitySlider": "Musesensitivitet: ",
    "soundButton": "Lyd: ",
    "fovSlider": "Synsfelt: ",
    "maxFPS": "Maks. FPS: ",
    "maxFPSUnlimited": "Maks. FPS: Ubegrænset",
    "debugCrashButton": "Debug: Crash spillet",
    "keybindsButton": "Tastebindinger",
    "languagesButton": "Sprog",
    "doneButton": "Bekræft",
    "preAlphaText": "Velkommen til Cosmic Reach! \n Spillet er tidligt i sin udvikling, derfor er der features som ikke er udviklet endnu. \n Forvent bugs, glitches, crashes, verdenskorruption og alt muligt andet godt da spillet ikke er færdigt endnu. \n Alt i spillet lige nu kan ændre sig og repræsenterer ikke nødvendigvis det endelige produkt. \n Man kan spille spillet i en ikke færdig tilstand for, at *du* kan komme med feedback og have indflydelse på, hvordan spillet kommer til at være i fremtiden. \n God testning og spil-ødelæggelse!",
    "okButton": "Ok",
    "Lighting": "Beslysning: ",
    "Respawn": "Genopstå",
    "Return_To_Game": "Fortset Spil",
    "Return_To_Menu": "Gå til Menu",
    "Saving": "Gemmer...",
    "Space_Day": "Dag i Rummet",
    "Dark_Night": "Mørk Nat",
    "Earth_Day": "Dag på Jorden",
    "Orange_Sky": "Orange Himmel",
    "Pitch_Dark": "Kulsort",
    "Overcast": "Overskyet",
    "Forward": "Gå Fremad",
    "Backward": "Gå Baglæns",
    "Left": "Gå til Venstre",
    "Right": "Gå til Højre",
    "Jump": "Hop",
    "Crouch": "Snig",
    "Sprint": "Løb",
    "Prone": "Kravl",
    "Inventory": "Åben/luk Tasken",
    "Drop_Item": "Kast Genstand",
    "Hide_UI": "Gem UI",
    "Screenshot": "Skærmbillede",
    "Debug_Info": "Debug Information",
    "No_Clip": "No-Clip",
    "Reload_Shaders": "Genindlæs Shaders",
    "Fullscreen": "Fuldskærm",
    "Create_New_World": "Lav Ny Verden",
    "worldNameButton": "Verdens navn: ",
    "defaultWorldName": "Ny Verden",
    "worldSeedLabel": "Verdens seed: <Tilfældig>",
    "worldSeedLabel2": "Verden seed: ",
    "worldType": "Verden Type: ",
    "Return_to_Main_Menu": "Gå til Hovedmenuen",
    "returnButton": "Tilbage",
    "Open_Worlds_Directory": "Åben Verdens Data (Stifinder)",
    "YT_Channel": "Følg med i udviklen af spillet på youtube.com/@finalforeach",
    "Game_version": "Cosmic Reach Version Pre-alpha-",
    "MAC_warning": "Advarsel: Mac (Apple) er ikke understøttet på nuværende tidspunkt. Det er ikke sikkert at spille kan køre på Mac.",
    "Controller": "Controller",
    "Controllers": "Controllerere",
    "Controller_info": " fundet!\nController support are ikke fuldt understøttet endnu,\ncontrollerunderstøttelse vil blive forbedret i senere opdateringer.",
    "on_state": "Tændt",
    "off_state": "Slukket",
    "World_name": "Verden-",
    "Screenshot_info": "Gemmer Skærmbillede til ",
    "Screenshot_error": "Fejl under lagring af Skærmbilledet.",
    "Loading": "Indlæser",
    "RuntimeException": "Fejl under åbningen af verdnen: ",
    "Tip1": "Omstrukturer kurver...",
    "Tip2": "Minimere hjørner...",
    "Tip3": "Former verdnen...",
    "Tip4": "Farver lysene...",
    "Tip5": "Halverer fliserne...",
    "Tip6": "Placere blokene...",
    "Tip7": "Stabler chunksene...",
    "Tip8": "Samler rumstøvet...",
    "Tip9": "Sætter blokene i kredsløb...",
    "Tip10": "Smider chunksene i system...",
    "Tip11": "Oster månen...",
    "Tip12": "Ryder op på værelset...",
    "Tip13": "Fresnel-ificerer...",
    "Tip14": "Kolonialisere stjernerne...",
    "Tip15": "Tip: Hurtig vælg blok med miderste muse knap!",
    "Tip16": "Tip: Prøv de forskellige belysningsindstilligere direkte fra pausemenuen!",
    "Tip17": "Tip: Tryk '$keybind_hideUI' for at gemme spil brugergrænsefladen væk",
    "Tip18": "Tip: Tryk '$keybind_screenshot' for at tage et Skærmbillede!",
    "Tip19": "Tip: Tryk '$keybind_debugInfo' for at vise debugging information",
    "Tip20": "Tip: Tryk '$keybind_dropItem' for at smide gendstanden du holder på jorden!",
    "Tip21": "Tip: Tryk '$keybind_openInventory' for at åbne din taske!",
    "Tip22": "Tip: Hvis du løber op imod en væg så kan du løbe langs den meget længere end, hvis du kun hoppede.",
    "OddTip1": "Poder celler...",
    "OddTip2": "Inkuberer...",
    "OddTip3": "Ofre undersåttere...",
    "OddTip4": "Tæller får...",
    "OddTip5": "Forkaster ødelagt væv...",
    "OddTip6": "Høster stamceller...",
    "OddTip7": "Samler organ\"donationer\"...",
    "OddTip8": "Iagttager tricephalous...",
    "OddTip9": "Gentager tests...",
    "OddTip10": "Kategoriserer organismer...",
    "OddTip11": "Tip: Kampen mod entropi er ikke en som du kan vinde.."
  }
  